"";"text";"type";"Englisch"
"68";"Meine Finanzierungsanfrage wurde schnell und engagiert bearbeitet. Die unternehmen GmbH kann man durchaus weiterempfehlen.";"Gewissenhaft";"My financing request was processed quickly and with commitment. The unternehmen GmbH can certainly be recommended to others."
"69";"Stets freundliche, kompetente und zielgerichtete Beratung und Betreuung seitens des Kundenberaters";"Gewissenhaft";"Always friendly, competent and targeted advice and support from the customer advisor"
"70";"Faire Beratung und gute Betreuung. Interessante Alternativen, die Wettbewerb aufzeigen";"Dominant";"Fair advice and good support. Interesting alternatives that demonstrate competition"
"71";"Schnell und unkompliziert!";"Dominant";"Fast and uncomplicated!"
"72";"kompetente und schnelle Abwicklung der Anfrage. top ausgebildete Mitarbeiter. schnelle Entscheidungen. Kommunikation mit dem Berater ging sehr schnell und reibungslos.";"Dominant";"competent and fast handling of the inquiry. highly trained employees. quick decisions. Communication with the consultant went very quickly and smoothly."
"73";"Gerne wieder. Sehr schnelle Bearbeitung";"Dominant";"I'd love to. Very fast processing"
"74";"Ich kann unternehmen nur empfehlen. Schnell, kompetent und nett Prof. Heinz Schelwat";"Initiativ";"I can only recommend undertaking. Fast, competent and nice Prof. Heinz Schelwat"
"75";"Es war ein sehr freundlicher Ansprechpartner und die Bearbeitung war auch sehr zügig.";"Stetig";"It was a very friendly contact person and the processing was also very fast."
"76";"unternehmen arbeitet auf hohem Niveau und ist ein absolut verlässlicher und kompetenter Partner in Sachen Finanzierung von Unternehmen und Geschäftsvorhaben. Die direkte Zuordnung eines Mitarbeiters bedeutet optimale Betreuung. Ebenfalls ist die Arbeitsweise transparent und verständlich. Ergebnis: eine absolute Top-Note für unternehmen!";"Initiativ";"The company works at a high level and is an absolutely reliable and competent partner when it comes to financing companies and business projects. The direct assignment of an employee means optimal support. The working method is also transparent and understandable. Result: an absolute top mark for companies!"
"77";"Absolute kurze Reaktionszeit, kompetente Unterstützung, schnelle Entscheidung.";"Dominant";"Absolutely short reaction time, competent support, quick decision."
"78";"Die Kundenberaterin Frau Laux ist kompetent und schnell, es werden klare und sichere Abläufe vorab besprochen. unternehmen kann ich jedem Unternehmen ans Herz legen.";"Initiativ";"Ms. Laux is a competent and fast client advisor, who discusses clear and secure procedures in advance. I can recommend a company to any company."
"79";"EINFACHE VERBINDUNG KOMPETENTE BERATUNG UND SCHNELLE ABWICKLUNG. EMPFEHLUNG";"Dominant";"SIMPLE CONNECTION COMPETENT ADVICE AND FAST PROCESSING. RECOMMENDATION"
"80";"Guter Service!";"Dominant";"Good service!"
"81";"Sehr schnelle Antwort und kompetente Beratung. Ich bin mit dem Service sehr zufrieden.";"Initiativ";"Very fast response and competent advice. I am very satisfied with the service."
"82";"Schnelle kompetente Beratung mit Erfolg! Mein Ansprechpartner war Hr. vorname nachname, er war schnell und zuverlässig. Zusagen wurden eingehalten. Kommunikation war einwandfrei. Hr. Prinz konnte die Kennzahlen richtig erkennen. Nach einer Woche war das gewünschte Darlehen ausgezahlt. Somit hat es sein Zweck absolut erfüllt.";"Dominant";"Quick and competent advice with success! My contact person was Mr. vorname surname, he was fast and reliable. Promises were kept. Communication was flawless. Mr. Prinz was able to identify the key figures correctly. After one week the desired loan was disbursed. Thus it has absolutely fulfilled its purpose."
"83";"reibungsloser Ablauf";"Dominant";"smooth process"
"84";"Das Gesamtpaket war Spitze und ist sehr zu empfehlen.";"Initiativ";"The overall package was great and is highly recommended."
"85";"unternehmen ist schnell, kompetent und liefert sehr gute und leicht verwertbare Ergebnisse.";"Dominant";"is fast, competent and delivers very good and easily usable results."
"86";"Ich bin sehr zufrieden mit Ihrer Dienstleistung , Herr nachname ist ein absolut kompetenter und zuverlässiger Mitarbeiter .";"Initiativ";"I am very satisfied with your service, Mr surname is an absolutely competent and reliable employee. "
"87";"Nur beste Erfahrungen!";"Initiativ";"Only the best experiences!"
"88";"Schneller, nette und kompetenter Kontakt. Einfache Abwicklung.";"Dominant";"Fast, nice and competent contact. Simple handling."
"89";"Sehr schnelle, kompetente und unkomplizierte Abwicklung/Beratung.";"Dominant";"Very fast, competent and uncomplicated processing / consulting."
"90";"Kompent & Schnell und Effizient!";"Dominant";"Competent & Fast and Efficient!"
"91";"Die Firma unternehmen und hier insbesondere Herr vorname nachname machen einen sehr kompetenten Eindruck. Schon nach wwenigen Tagen lag das erste annehmbare Angebot vor. Ich bin mehr als zufrieden.";"Stetig";"The company and here in particular Mr first name surname make a very competent impression. Already after a few days the first acceptable offer was available. I'm more than happy. "
"92";"Hervorragende und sehr schnelle Bearbeitung eines Firmen-Kredites. Super toller und kompetenter Kontakt zu dem Mitarbeiter. Positiver Bescheid innerhalb weniger Tage mit Auszahlung des Kreditbetrages noch am selben Tag nach der Genehmigung. Das mit Abstand beste im Bereich von gewerblichen Finanzierungen, was ich den letzten 20 Jahren Business erlebt habe. 5-Sterne plus Empfehlung. Peter Mintel";"Initiativ";"Excellent and very fast processing of a corporate loan. Super great and competent contact to the employee. Positive decision within a few days with payment of the loan amount on the same day after approval. By far the best in commercial finance I have experienced in the last 20 years of business. 5 stars plus recommendation. Peter Mintel"
"93";"Eine tolle Beratung führte zur optimalen Finanzierung, die sehr schnell abgewickelt wurde.";"Stetig";"Great advice led to optimal financing, which was handled very quickly."
"94";"Sofortige und schnelle Hilfe Immer eine Lösung parat Freundliches Personal";"Initiativ";"Immediate and fast help Always a solution at hand Friendly personnel"
"95";"Super Service, freundliche, vertrauensvolle Finanzberater, große Anzahl an Finanzierungspartnern, sehr seriös, normaler Aufwand beim einreichen der benötigten Unterlagen";"Stetig";"Super service, friendly, trustful financial advisors, large number of financing partners, very serious, normal effort in submitting the required documents"
"96";"Der Kontakt kam unkompliziert zustande. Ich bin regelmäßig zurückgerufen worden und ebenso regelmäßig über den derzeitigen Stand des Projektes auf dem Laufenden gehalten worden. Auftretende Fragen wurden sofort und umfassend beantwortet, Probleme auch mit aktiven Vorschlägen aus der Welt geschafft. Einzig der Auswahlprozess, der letztendlich zur Wahl des Investors geführt hat, war nicht komplett transparent.";"Gewissenhaft";"The contact was uncomplicated. I have been regularly called back and kept up to date on the current status of the project. Questions that arose were answered immediately and comprehensively, and problems were solved with active suggestions. Only the selection process, which ultimately led to the choice of the investor, was not completely transparent."
"97";"Gute Kombination von digitaler Abwicklung und persönlicher Betreuung bei Leasinganfragen";"Gewissenhaft";"Good combination of digital processing and personal support for leasing enquiries"
"98";"Sehr gute Partnerschaft!!! Seit Sommer 2018 4 Vorgänge abgewickelt und alles immer rasant schnell. Ein Ansprechpartner der immer erreichbar ist. Bisher nichts zu bemängeln.";"Initiativ";"Very good partnership!!! Since the summer of 2018, 4 processes have been processed and everything is always fast. A contact person who is always available. Nothing to criticize so far."
"99";"Top schnelle kompetente Abwicklung absolute Profis am Werk";"Initiativ";"Top fast competent handling absolute professionals at work"
"100";"Letztlich toll, dass es funktioniert hat und das Engagement von Herrn nachname ist klasse. Das zurückgezogene Angebot der APO Bank hat uns leider einige Probleme bereitet";"Gewissenhaft";"In the end it was great that it worked and the commitment of Mr. surname is great. Unfortunately, the withdrawal of APO Bank's offer caused us a number of problems"
"101";"Schnelle und einfache Bearbeitung, gute Beratung";"Dominant";"Quick and easy processing, good advice"
"102";"Als Berater ist unternehmen die Super Ergänzung, die Zusammenarbeit ist super, besonders mit Herrn nachname. Vielen Dank";"Initiativ";"As a consultant undertaking is the super complement, the collaboration is super, especially with gentleman last name. Thank you very much."
"103";"Sehr korrekte Abwicklung, passt Alles!";"Dominant";"Very correct handling, everything fits!"
"104";"Zuverlässiger Partner Ich habe unternehmen über das Internet gefunden und einen Finanzdienstleister gesucht, der uns die nächsten Jahre begleitet und auch eine schwierige Anfangsphase nicht scheut. Uns wurde professionel geholfen und die Situation wurde realistisch eingeschätzt. Massgeschneiderte Lösungen angeboten. Hat unsere Erwartungen übertroffen, wir sind zufrieden und sehen der weiteren Zusammenarbeit entgegen. Weiter so";"Stetig";"Reliable partner I have found companies via the Internet and have been looking for a financial services provider who will accompany us for the next few years and who is not afraid of a difficult initial phase. We were professionally helped and the situation was realistically assessed. Tailor-made solutions offered. Has exceeded our expectations, we are satisfied and look forward to further cooperation. Keep up the good work"
"105";"Bei unternehmen ist man von Anfang an gut beraten: Mit Ehrlichkeit, Prägnanz und Sachkenntnis geht der Kundenberater ran und begleitet einem bis zum Schluss der Kreditvergabe. Ich kann unternehmen nur weiterempfehlen!";"Stetig";"Companies are well advised right from the start: With honesty, conciseness and expertise, the client advisor approaches you and accompanies you right up to the end of the lending process. I can only recommend company!"
"106";"Schnell und unkomoliziert";"Dominant";"Fast and uncompressed"
"107";"Wir waren mit unternehmen in der Lage einen Unternehmenskredit zu bekommen, vielen Dank für die Zusammenarbeit!";"Stetig";"We were able to get a corporate loan with companies, thank you very much for your cooperation!"
"108";"Super kompetent, zuverlässig und schnell.";"Dominant";"Super competent, reliable and fast."
"109";"Perfekter Service - super schnelle Abwicklung. Nur zu empfehlen";"Initiativ";"Perfect service - super fast processing. Recommended only"
"110";"Super schnell, sehr kompetent und angenehm in der Zusammenarbeit";"Initiativ";"Super fast, very competent and pleasant to work with"
"111";"Hat mit gut gefallen!";"Initiativ";"I liked it!"
"112";"Bekam leider nur ein Angebot, was nicht zu meiner finanziellen Lage passte...trotzdem Danke für die Bemühungen!";"Stetig";"Unfortunately I only got one offer, which did not fit my financial situation...thanks for all your efforts!"
"113";"Als kleines Unternehmen (17 Mitarbeiter) haben wir bis dato nur Erfahrungen mit den regionalen Banken gemacht. Trotz positiver Berichterstattung waren wir skeptisch und sind mit einer geringen Erwartungshaltung an unternehmen herangetreten. Abschließend möchten wir sagen, dass die Zusammenarbeit sehr positiv war. Die Kommunikation war einwandfrei und immer bemüht das für uns bestmögliche Ergebnis zu erzielen. Auch über die normalen Geschäftszeiten hinaus war stets jemand ansprechbar und bereit Hilfestellung zu leisten.";"Stetig";"As a small company (17 employees), we have only had experience with regional banks to date. Despite positive reporting, we were sceptical and approached companies with low expectations. Finally, we would like to say that the cooperation has been very positive. The communication was impeccable and always tried to achieve the best possible result for us. Even after normal business hours, someone was always available and ready to help."
"114";"Super, tolle Beratung und Service";"Initiativ";"Super, great advice and service"
"115";"Guter Service, gute Erklärungen, Seriöses Angebot!";"Dominant";"Good service, good explanations, serious offer!"
"116";"Vom ersten Moment an, füllte ich mich bei unternehmen sehr gut aufgehoben. Die Vermittlung von Krediten klappte reibungslos. Banken, welche mir in der Vergangenheit keine Kredite zugesagt hatten, genehmigten mir jetzt Kredite. Die Zusammenarbeit war ein voller Erfolg.";"Stetig";"From the very first moment, I was in very good hands with unternehmen. The brokerage of loans went smoothly. Banks, which had not promised me any loans in the past, now approved loans for me. The cooperation was a complete success."
"117";"In der sehr schnelllebigen veränderbaren Welt der Banken und Berater hat sich unternehmen, und hier insbesondere Herr nachname sehr wohltuend hervorgehoben. Professionell, extrem kompetent und eben auch persönlich sind die Themen angegangen und mit einer ausgesprochenen Schnelligkeit gepaart mit der Fokussierung auf die unternehmerischen Belange abgezielt erfolgreich umgesetzt worden. Empfehlung? Gar keine Frage, unternehmen ist weiterzuempfehlen. Und hier auch die besten Wünsche für weitere erfolgreiche Transaktionen.";"Initiativ";"In the very fast-moving and changing world of banks and advisors has become a company, and here in particular Mr. surname very beneficially highlighted. The topics were approached professionally, extremely competently and also personally and were successfully implemented with a pronounced speed paired with a focus on entrepreneurial concerns. Recommendation? There's no question about it, we recommend doing it. And here also the best wishes for further successful transactions."
"118";"Ihr seid ein tolles kompetentes Team, es macht Spass mit euch zusammen zu arbeiten. Richtig gute Mitarbeiter, sind welche, ... die richtig Potenzial haben und Interesse zeigen. die sich einbringen wollen. die selbständig mitdenken und Ideengeber sind. die ein Unternehmen voranbringen (wollen). die dem Unternehmen und Projekt Persönlichkeit geben. die der Firma und den Chefs gegenüber Loyal sind in einigen Gespächen mit Ihnen Frau Di Benedetto, mit Herr Rossa, Herr nachname ( sehr guter angenehmer Mann)und Herr nachname ( der kommt sehr ernst rüber, aber sehr kompetent, ich bin überzeugt, dass der es drauf hat) und nicht zu vergessen Frau nachname ( toller Mensch, sehr engagiert) habe ich getestet wie loyal ihr gegenüber euerer Firma und den Chefs seid, ihr habt alle mit Bestnote bestanden, ihr seid ein tolles Team. Ich hoffe ich werde die anderen Mitarbeiter auch mal kennen lernen. Jetzt aber zu den Chefs: Top-Mitarbeiter verlassen niemals ihren Job, sondern ihren Chef. Guten Mitarbeitern sind immer folgendes wichtig und das sollten Führungskräfte immer wissen: Arbeitsklima Kollegenfreundschaft interessante Aufgaben Entwicklungschancen gewisse Freiheiten (Homeoffice, Arbeitsbeginn etc.) und ich glaube ihre Chefs beherschen und beachten dies. Ihr seid alle dann gut aufgehoben. Sie sind auf jeden Fall kompetent, sonst wären sie nicht in der Lage gewesen, so eine tolle Mannschaft zusammen zu schweißen. Für mein Team ist es wichtig mit einer seriösen Firma zusammen zu arbeiten, deren Mitarbeiter kompetent sind, deshalb arbeiten wir mit ihnen zusammen. Wir werden noch viele unserer Kunden an sie weiter vermitteln. Schöne Grüße aus dem Saarland. Michler";"Initiativ";"You are a great competent team, it is fun to work together with you.    Really good employees are those who ... have the right potential and show interest ... who want to contribute ... who think for themselves and give ideas ... who want to advance a company ... who give personality to the company and the project. the ones of the company and the bosses towards Loyal are in some conversations with you Mrs. Di Benedetto, with Mr. Rossa, Mr. surname (very good pleasant man) and Mr. surname (he comes over very seriously, but very competent, I am convinced that he has it) and not to forget Mrs. surname (great man, very engaged) I have tested how loyal you are towards your company and the bosses, you all passed with top marks, you are a great team. I hope I will get to know the other employees as well. But now to the bosses: Top employees never leave their job, but their boss.    Good employees are always concerned about the following and managers should always know this: Work climate colleagues friendship interesting tasks development opportunities certain freedoms (home office, start of work etc.) and I believe their bosses master and observe this. You'll all be in good hands. They are competent in any case, otherwise they would not have been able to weld such a great team together. For my team it is important to work together with a reputable company whose employees are competent, therefore we work together with them. We will continue to refer many of our customers to them. Greetings from Saarland. Michler"
"119";"Ich machte zu meiner Überraschung wirklich gute Erfahrungen, war zu Beginn naturgemäß skeptisch. Auch wenn es in unserem Fall kein Darlehnsabschluss zustande kam würde ich diese Plattform wieder aufsuchen.";"Gewissenhaft";"To my surprise, I had really good experiences and was naturally sceptical at the beginning. Even if there was no loan agreement in our case, I would visit this platform again."
"120";"Sehr guter Service realisiert durch meinen persönlichen unternehmen-Berater mittels seines 100%-igen Einsatzes zugunsten einer professionellen Abwicklung mit erfolgreichen Resultat.";"Initiativ";"Very good service realized by my personal business consultant by means of his 100% commitment in favor of a professional handling with successful result."
"121";"Alles Super";"Initiativ";"Everything Super"
"122";"Sehr gute Beratung, kompetenten und sehr einsatzbereit, bin sehr zufrieden.";"Initiativ";"Very good advice, competent and very ready for action, I am very satisfied."
"123";"sehr kunden- & serviceorientiert";"Dominant";"very customer- & service-oriented"
"124";"Professionelle Abwicklung und vor allem Lösungsorientiert. Sehr gute Konditionen bekommen. Jederzeit zu empfehlen!";"Dominant";"Professional handling and above all solution-oriented. Very good conditions. Always recommended!"
"125";"Ausgezeichnete und schnelle Beratung, es wurden maßgeschneiderte Finanzprodukte für uns gefunden!";"Dominant";"Excellent and fast advice, tailor-made financial products were found for us!"
"126";"Hervorragende kompetente Beratung. War am Beginn etwas Misstrauisch, kann unternehmen aber wirklich als Top Beratung empfehlen. Wir konnten innerhalb kürzester Zeit, und völlig unkompliziert mehrere Transporter und Baumaschinen finanzieren. Vielen Dank dafür...";"Initiativ";"Excellent competent advice. Was a little suspicious in the beginning, but can really recommend undertaking as top advice. We were able to finance several transporters and construction machines within a very short time and in a completely uncomplicated manner. Thank you very much for..."
"127";"Hervorragende Beratung! Der Service von Compoeon ist freundlich, schnell, kompetent, flexibel und sehr lösungsorientiert. Die Erwartungen wurden am Ende mehr als erfüllt. unternehmen ist auf jeden Fall eine Empfehlung wert.";"Initiativ";"Excellent advice! Compoeon's service is friendly, fast, competent, flexible and very solution-oriented. At the end of the day, the expectations were more than fulfilled."
"128";"rundum kompetente Beratung und sehr zuvorkommender Service einfach toll und unkompliziert super";"Initiativ";"all around competent advice and very courteous service    simply great and uncomplicated super"
"129";"Guter Service. Als Neukunde wurde mir von meinem persönlichen Ansprechpartner, genau mitgeteilt was benötigt wird um die Ausschreibung richtig zu erstellen. Nach Erhalt der Resultate ging die persönliche Betreuung bis zum positiven Abschluss weiter. Sehr zu empfehlen!";"Stetig";"Good service. As a new customer, my personal contact person told me exactly what is needed to create the tender correctly. After receiving the results, the personal support continued until the positive conclusion. Highly recommended!"
"130";"Sehr gute, unkomplizierte und kompetente Beratung";"Dominant";"Very good, uncomplicated and competent advice"
"131";"Super Service, kompetente Beratung, starke Plattform! Auf jeden Fall empfehlenswert!";"Initiativ";"Super service, competent advice, strong platform! In any case recommendable!"
"132";"Kompetente Beratung, problemlose Abwicklung der Finanzierung, Danke";"Dominant";"Competent advice, problem-free handling of financing, thank you"
"133";"Sehr kompetente Gesprächspartner, gerade dann, wenn es nicht um den Standard geht!";"Dominant";"Very competent interlocutors, especially when it's not about the standard!"
"134";"Das Verfahren funktionierte einfach und war bereits nach kurzer Zeit positiv abgeschlossen.";"Dominant";"The procedure worked simply and was already positively completed after a short time."
"135";"Danke für die schnelle und unkomplizierte Unterstützung in meinen Finanzierungsfragen. Selten so gut betreut worden. Viele Danke an das gesamte Team von unternehmen";"Initiativ";"Thank you for the fast and uncomplicated support in my financing questions. Seldom been so well looked after. Many thanks to the entire team of companies"
"136";"Leider gar nicht digital sondern sehr manuell";"Dominant";"Unfortunately not digital at all but very manual"
"137";"Perfekter Service. Schnelle Rückmeldung und Beratung über Detailfragen wie genau die Ausschreibung gestaltet werden soll. Nach ca. 2 Wochen hatten wir schon Angebote von Banken vorliegen.";"Stetig";"Perfect service. Quick feedback and advice on detailed questions on how exactly the tender should be designed. After approx. 2 weeks we had already received offers from banks."
"138";"Die Beratung durch unternehmen war hervorragend, weil sie proaktiv und flexibel auf unsere Bedürfnisse einging. Im Ergebnis konnten wir so zusammen mit dem sehr kompetenten unternehmen-Berater und dem verfügbaren Banken-Netzwerk ein maßgeschneidertes und sehr attraktives Finanzierungspaket realisieren. Bei unserer nächsten Finanzierung werde ich mich daher wieder sehr gerne an unternehmen wenden.";"Stetig";"The advice provided by companies was excellent because it was proactive and flexible in responding to our needs. As a result, we were able to realize a tailor-made and very attractive financing package together with the very competent management consultant and the available banking network. I will therefore be very happy to turn to companies again for our next financing."
"139";"Die Qualität, Geschwindigkeit und auch das persönliche Engegemant der Services von unternehmen, explizit auch in Person von Herrn nachname, war herausragend. Vielen Dank nochmal!";"Stetig";"The quality, speed and also the personal closeness of the services of companies, explicitly also in the person of Mr. surname, was outstanding. Thanks again! "
"140";"Da eine Finanzierung bereits realisiert wurde, kann ich nichts nachteiliges sagen. Diese Finanzierung wurde schnell, und für unseren Kunden positiv beendet. MFG H & W Financial Service Ltd. Herbert Walter";"Gewissenhaft";"Since a financing has already been realized, I cannot say anything detrimental. This financing was quickly and positively ended for our customer.    MFG H & W Financial Service Ltd. Herbert Walter"
"141";"Sehr gute Beratung und Unterstützung!";"Initiativ";"Very good advice and support!"
"142";"Kompetente und sehr engagierte Ansprechpartner. Insbesondere ein ganz großes Dankeschön an Herrn nachname; sehr gute Beratung!! Das Finanzierungsmodell ist individuell auf unser Unternehmen abgestimmt und die Konditionen sind sehr gut. Eine Zusammenarbeit mit unternehmen ist empfehlenswert.";"Initiativ";"Competent and very committed contact persons. Especially a big thank you to Mr. surname; very good advice! The financing model is individually tailored to our company and the conditions are very good. Cooperation with companies is recommended."
"143";"schnelle kompetete Beratung - zeitnahe Bearbeitung - freundliche Mitarbeiter";"Dominant";"fast competent advice - prompt processing - friendly employees"
"144";"bei uns ging es um den Mietkauf einer Maschine, die Bearbeitung und Erstellung der Angebote lief problemlos und sehr kurzfristig. Ich würde jederzeit wieder anfragen.";"Gewissenhaft";"We were concerned with the hire purchase of a machine, the processing and preparation of the quotations ran smoothly and at very short notice. I would ask again at any time."
"145";"Zügige Abwicklung und unkompliziert.";"Dominant";"Quick handling and uncomplicated."
"146";"Frau Sobotta hat mir unkompliziert und mit sehr viel Bemühungen weitergeholfen. Sehr zu empfehlen. Vielen herzlichen Dank";"Stetig";"Mrs. Sobotta helped me uncomplicated and with a lot of efforts. Highly recommended. Thank you very much. "
"147";"Der Service und die Beratung waren sehr gut. Ich kann es nur Empfehlen.";"Stetig";"The service and advice were very good. I can only recommend it."
"148";"hat hervorragend funktioniert. Alles ging einfach, schnell und unkompliziert. Die Konditionen die ich bekam waren sehr gut.";"Dominant";"has worked excellently. Everything was simple, fast and uncomplicated. The conditions I got were very good."
"149";"Hervorragende Unterstützung. Es bleiben keine Fragen offen.";"Initiativ";"Excellent support. No questions remain unanswered."
