"";"text";"type";"Englisch"
"1";"Die Unterstützung und das Engagement unserer Account-Managerin von unternehmen war vorbildlich.";"Gewissenhaft";"The support and commitment of our corporate account manager was exemplary."
"2";"schnell, unkompliziert, kompetent und freundlich";"Initiativ";"fast, uncomplicated, competent and friendly"
"3";"Sehr gute kompetente Beratung und schnelle, bedarfsorientierte Abwicklung";"Dominant";"Very good competent advice and fast, demand-oriented processing"
"4";"Super Portal, Super Kontakt jederzeit wieder!";"Initiativ";"Super Portal, Super Contact anytime again!"
"5";"Hervorragend – nur positive Erfahrungen, das Unternehmen ist weiterzuempfehlen.";"Initiativ";"Excellent - only positive experiences, the company can be recommended."
"6";"Die Zusammenarbeit, die schnelle unkomplizierte Kommunikation und die mustergültige Abwicklung sind 5* wert. Vielen Dank für die Unterstützung und bis zum nächsten Projekt.";"Initiativ";"The cooperation, the fast and uncomplicated communication and the exemplary handling are worth 5*.  Thank you very much for your support and until the next project."
"7";"unternehmen hat mir wirklich sehr schnell und unbürokratisch weitergeholfen. Vor allem die Erreichbarkeit des Betreuers und die Flexibilität ist stark. Vieeelen herzlichen Dank hervorzuheben. ";"Initiativ";"The company really helped me very quickly and unbureaucratically. Above all, the accessibility of the supervisor and the flexibility are strong Vieeelen heartfelt thanks to emphasize. "
"8";"Schnelle und professionelle Hilfe, taggenuae Bearbeitung. Bei nicht einfachen Bedingungen für den Finanzierer werden über den Tellerrand schauende Geldgeber vermittelt.";"Gewissenhaft";"Fast and professional help, day-to-day processing. If the conditions for the financier are not easy, donors who look beyond their own horizons are placed."
"9";"Unkompliziert und schnell";"Dominant";"Uncomplicated and fast"
"10";"ich habe mich gut beraten und aufgehoben gefühlt. Herr nachname hat auch während der Finanzierungsgestaltung mit der Bank, oft sich selbständig nach dem Stand der Dinge erkundigt und stand grundsätzlich in allen Belangen beratend zur Seite.";"Stetig";"I felt well advised and in good hands. Mr. surname has also during the financing arrangements with the bank, often independently inquired about the state of affairs and was always available to advise in all matters."
"11";"Besten Dank für die gute Abwicklung! Auch beim nächsten Mal werden wir Ihren Service gerne wieder nutzen.";"Stetig";"Thank you very much for the good handling! We will be happy to use your service again next time."
"12";"Sehr fachliche Beratung und schnelle, freundliche Bearbeitung";"Initiativ";"Very professional advice and fast, friendly processing"
"13";"Ich hätte es nicht geglaubt! Aber 2 Std nach Veröffentlichung der Ausschreibung lag das erste - sehr gute Angebot einer Bank vor. Innerhalb von einer Woche - und das trotz der Osterfeiertagen - war das Darlehen auf meinem Konto. Schnelle, unbürokratische Abwicklung. Professionelle Begleitung. Absolut empfehlenswert!";"Initiativ";"I wouldn't have believed it! But 2 hours after the publication of the tender there was the first - very good offer of a bank. Within a week - despite the Easter holidays - the loan was on my account. Fast, unbureaucratic processing Professional support Absolutely recommendable!"
"14";"Guter Kontakt, gute Beratung. Auch wenn wir diesesmal am Ende nicht zusammengekommen sind, kommen wir trotzdem gerne wieder auf Ihren Service zurück.";"Stetig";"Good contact, good advice. Even if we didn't get together at the end this time, we will still be happy to return to your service."
"15";"Als Selbständige ist es nicht so einfach ein Darlehen zu bekommen. Die Finanzexpertin Frau nachname führte zuerst mit mir ein Gespräch, um sich ein Bild meiner Lage zu machen. Nachdem ich dann alle Unterlagen zusammengestellt hatte und zu meiner Finanzexpertin mailte, machte sie sich gleich an die Arbeit und hatte ein positives Ergebnis binnen 24 Stunden. Damit hatte ich nicht gerechnet und bin noch total überrascht und freue mich sehr, über das Ergebnis. Ich kann nur jedem raten, an seine Träume zu glauben und die richtigen Experten dafür zu finden und die sind bei unternehmen... Herzlichen Dank und bin gespannt, was noch kommt!";"Stetig";"As a self-employed it is not so easy to get a loan. The financial expert Frau surname first had a conversation with me to get a picture of my situation. After I had compiled all the documents and e-mailed them to my financial expert, she went straight to work and had a positive result within 24 hours. I hadn't expected that and am still totally surprised and very happy about the result. I can only advise everyone to believe in their dreams and to find the right experts for them and they are at companies... Thank you very much and I'm curious to see what's to come!"
"16";"Wir haben kurzfristig eine Liquiditätsspritze benötigt innerhalb von rund 2 Wochen hatten wir das Geld auf unserem Konto. Herr nachname hat uns sehr gut beraten und begleitet. Wir können Herrn Nitsche sowie unternehmen zu 100 % weiterempfehlen.";"Stetig";"We have needed a short-term liquidity injection within about 2 weeks we had the money in our account. Mr. surname advised and accompanied us very well. We can recommend Mr. Nitsche and the company 100 %."
"17";"Schnelle Abläufe, kompetent";"Dominant";"Fast processes, competent"
"18";"Klasse Abwicklung, unkompliziert und schnell! Die Bankberaterin von unternehmen war super, ich war immer auf dem laufenden und somit konnten Fragen sofort beantwortet und geklärt werden! Ich werde Finanzen zukünftig nur noch über unternehmen abwickeln!";"Initiativ";"Great handling, uncomplicated and fast! The bank consultant of unternehmen was great, I was always up to date and so questions could be answered and clarified immediately! In the future, I will only handle finances through companies!"
"19";"Schnell, professionell und direkt. Man muß nicht lange warten dann rufen Sie einen zurück. Die Firma unternehmen geht auf einen ein. Vielen Dank an Herr D.....";"Initiativ";"Fast, professional and direct. You don't have to wait long then call one back. The company company will respond to you. Many thanks to Mr D....."
"20";"unternehmen ist nicht bloß eine kalte FinTech-Plattform, die Daten von links nach rechts verschiebt. unternehmen ist ein Team von echten Profis, die Dinge ermöglichen.";"Initiativ";"company is not just a cold FinTech platform that moves data from left to right. company is a team of real professionals who make things happen."
"21";"Es war uns eine Freude , mitzuerleben , dass es in dieser Branche noch Menschen gibt neben Computerzahlen und Annonymität. Vielen Dank ! S. DILLING";"Initiativ";"It was a pleasure for us to see that there are still people in this industry besides computer numbers and anonymity. Thanks a lot! S. DILLING"
"22";"Schnell, kompetent, günstiger Zinssatz, uneingeschränkt empfehlenswert";"Dominant";"Fast, competent, favourable interest rate, unrestrictedly recommendable"
"23";"Persönliche Betreuung, sehr nette Kollegen, schnelle Abwicklung.";"Initiativ";"Personal care, very nice colleagues, quick handling."
"24";"Persoenliche, freundliche und kompetente Betreuung. Sehr professionell und gut organisierte, schnell erfolgreiche Durchfuehrung unserer Ausschreibung. TOP Abwicklung Note 1+";"Initiativ";"Personal, friendly and competent support. Very professional and well organized, quickly successful execution of our tender. TOP processing grade 1+"
"25";"Herr nachname ist der Mann für das Unmögliche. Vielen vielen Dank";"Initiativ";"Lord last name is the man for the impossible. Thank you very much."
"26";"Der Berater kam mit einem Produkt auf uns zu, welches zu unseren Geschäftsinhalten gepasst hat und entsprechend auch zum Tragen kam. Kurze und prägnante Absprachen haben den Prozess sehr effizient gemacht und haben zum Erfolg geführt.";"Gewissenhaft";"The consultant approached us with a product that fitted in with our business content and also had a corresponding impact. Short and concise agreements made the process very efficient and led to success."
"27";"super, hat alles schnell und reibungslos geklappt. gute Beratung";"Initiativ";"super, everything worked out quickly and smoothly. good advice"
"28";"Herr vorname nachname hat mich von Beginn der Kontaktaufnahme bis zur Auszahlung der Kreditsumme perfekt beraten und war immer erreichbar. Sehr empfehlenswert!!";"Initiativ";"Mr. vorname surname advised me perfectly from the beginning of the contact until the payment of the loan amount and was always available. Very recommendable!"
"29";"Antragsprozess lief reibungslos ab, sehr nette und vorbildliche Kommunikation und Unterstützung bei Fragen. Herr nachname hat uns sehr gut und kompetent betreut. Reibungslose und seriöse Angebote und schnelle Kreditauszahlung. Selbst nach der Auszahlung steht uns Herr Hoffhaus weiterhin gerne zur Verfügung. Insgesamt sehr positive Erfahrung, man kann es bedenkenlos weiterempfehlen.";"Stetig";"The application process ran smoothly, very nice and exemplary communication and support with questions. Mr. surname cared for us very well and competently. Smooth and reliable offers and fast loan disbursement. Even after the payment Mr. Hoffhaus is still at our disposal. Overall very positive experience, one can recommend it without hesitation."
"30";"Freundliche und kompetente Mitarbeiter, die Vermittlung hat nur wenige Tage gedauert. Top!";"Initiativ";"Friendly and competent staff, the mediation took only a few days. Top!"
"31";"Mein unternehmen Kundenbetreuer hat sich sehr gut mit unserem Geschäftsmodell beschäftigt Und dabei die richtigen Fragen gestellt um unser Unternehmen lukrativ gegenüber Kreditgebern darzustellen sowie mit Zahlen und Fakten zu untermauern. Entsprechend haben wir schnell den idealen Finanzpartner für unser Wachstum gefunden. Vielen lieben Dank für die Unterstützung!";"Gewissenhaft";"My company Account Manager has been very well involved with our business model, asking the right questions to lucratively present our company to lenders and back it up with facts and figures. Accordingly, we quickly found the ideal financial partner for our growth. Thank you very much for your support!"
"32";"Professionelle und schnelle Abwicklung. Wir konnten einen neuen Bankpartner gefunden und in sehr kurzer Zeit zu unterschriftsreifen Verträgen kommen. Gerne wieder.";"Gewissenhaft";"Professional and fast processing. We were able to find a new banking partner and reach contracts ready for signing in a very short time. I'd love to."
"33";"Das war ein tolles Ergebniss.Für den guten Service kann man sich nur Bedanken ! Mit einem Unternehmen wie diesem an der seite macht es wieder Spaß Unternehmer zu sein !! Ich kann nur sagen weiter so !!";"Initiativ";"This was a great result and we can only thank you for the good service ! With a company like this on the site it's fun to be an entrepreneur again! All I can say is keep it up!"
"34";"Super Beratung. Toller Service und sehr schnell. Kann ich nur jedem empfehlen.";"Initiativ";"Great advice. Great service and very fast. I can only recommend it to anyone."
"35";"Top Beratung und erfolgreicher Abschluss! Vielen Dank, ich kann Sie jedem jederzeit empfehlen.";"Initiativ";"Top advice and successful conclusion! Thank you, I can recommend you to anyone at any time."
"36";"Super Service! Wir sind mit der Beratung von Herrn nachname sehr zufrieden. Die Gespräche waren stets von Offenheit und Vertrauen geprägt. Jederzeit gerne wieder.";"Initiativ";"Super Service! We are very satisfied with the advice given by Mr. surname. The discussions were always characterized by openness and trust. Anytime again."
"37";"Top-Service. Sehr lösungsorientiert und schnell. Rückfragen an die Finanzierungsgeber wurden schnell und kompetent bearbeitet und im Kundensinne vermittelt. Finanzierungen erfolgten erfolgreich und schnell. Sehr moderne und fast papierlose Abwicklung. Jederzeit gerne wieder.";"Gewissenhaft";"Top service. Very solution-oriented and fast. Questions to the financing providers were dealt with quickly and competently and mediated in the customer's interest. Financing was successful and fast. Very modern and almost paperless handling. Anytime again."
"38";"die Betreuung durch Herrn nachname war professionell , kompetent und erfolgreich. Die Begleitung bei der Antragstellung war sehr hilfreich. in wenigen Tagen war das gewünschte Ergebnis realisiert.";"Gewissenhaft";"the support by Mr. surname was professional, competent and successful. The support during the application process was very helpful. the desired result was achieved in just a few days."
"39";"Kompetent, Lösungsorientiert, Schnell - Gespräche auf Augenhöhe und immer auf dem Laufenden gehalten. Besser geht es nicht.";"Initiativ";"Competent, solution-oriented, fast - conversations at eye level and always kept up to date. That's as good as it gets."
"40";"Unklompiziert Schnell";"Dominant";"Uncomplicated Fast"
"41";"Ich kann leider nur 5 Sterne geben. Herr nachname von unternehmen hat mich trotz erschwerter Bedingungen immer sehr kompetent betreut und letztendlich mir meinen Wunsch näher gebracht. TOP!";"Initiativ";"I'm afraid I can only give five stars. Despite difficult conditions, Mr. surname von unternehmen has always been very competent in looking after me and ultimately brought me closer to my wish. TOP! "
"42";"Vielen Dank für die tolle Unterstützung von unternehmen! Ich bin sehr zufrieden mit der Arbeit und vor allem hatte ich immer das Gefühl, dass man sich echt Zeit nimmt und sich um den Kunden richtig gut kümmert und das mit einem festen Ansprechpartner, der auch immer zu erreich war, oder sich umgehend gemeldet hat. Ich würde jederzeit wieder mit unternehmen arbeiten. Viele Grüße Lutz Schumann Druckerei Schumann";"Initiativ";"Many thanks for the great support of unternehmen! I am very satisfied with the work and above all I always had the feeling that you take real time and take really good care of the customer and that you did so with a fixed contact person who was always available or contacted me immediately. I would always work with unternehmen again. Many greetings Lutz Schumann Schumann Printing Company"
"43";"Nachdem ich zunächst durch einen Mitarbeiter einen ablehnenden Bescheid bekommen habe hat sich ein paar Tage später ein anderer Mitarbeiter bei mir gemeldet und mir mitgeteilt, dass es wohl doch noch eine Möglichkeit gibt für meinen Antrag auf eine Finanzierung. Es hat nicht lange gedauert und ich bekam ein gutes Angebot welches ich dann auch angenommen habe. Ich kann das Unternehmen unternehmen nur bestens empfehlen was die sehr gute Kompetenz, die Freundlichkeit, die Erreichbarkeit und die schnelle Bearbeitung angeht, absolut weiter empfehlen! Wenn ich mich da an einem anderen Vermittler erinnere, wo 6.000,00 € zzgl. MwSt. Vermittlungsgebühr von dem beantragten Darlehen fällig werden und sofort bei der Auszahlung abgezogen werden, und das bei einem Zinnssatz von 14,49 %, dann bin ich froh, das es bei unternehmen so reibungslos und Kostengünstig abgewickelt wurde!";"Gewissenhaft";"After I first received a refusal from an employee, another employee contacted me a few days later and informed me that there was still a possibility for my application for financing. It didn't take long and I got a good offer which I accepted. I can only highly recommend the company as far as the very good competence, the friendliness, the accessibility and the fast processing are concerned, absolutely recommend it! If I remember another mediator where 6.000,00 € plus VAT. If a commission fee is due on the loan applied for and deducted immediately upon payment, and at a rate of 14.49%, then I am glad that it was handled so smoothly and inexpensively by companies!"
"44";"Kurze Bearbeitungszeit und gute Angebote. Verbindliche Zusagen.";"Dominant";"Short processing time and good offers. Binding commitments."
"45";"Nach einer kleinen Anlaufschwierigkeit (es mussten einige Unterlagen mehr als angenommen zusammengetragen werde) hat die Abwicklung und vor allem die Begleitung durch unternehmen hervorragend auch zwischen den Feiertagen geklappt. Gerne wieder. Danke.";"Stetig";"After a small initial difficulty (some documents had to be collected more than expected), the processing and especially the company support worked excellently even between the holidays. I'd love to. Thank you. I'll take care of it."
"46";"Alles bestens";"Dominant";"Everything is fine"
"47";"Kompetent und hilfsbereit!";"Initiativ";"Competent and helpful!"
"48";"Es war für uns eine der besten Erfahrungen zusammen mit unternehmen eine Finanzierung für unseren Fuhrpark zu finden... Wir möchten uns an dieser Stelle nochmals bedanken und wir werden sicherlich auf unternehmen zurück kommen. Vielen Dank";"Initiativ";"It was one of the best experiences for us to find a financing for our fleet together with companies... We would like to take this opportunity to thank you again and we will certainly come back to unternehmen. Thank you very much."
"49";"Wir sind ein typisches KMU, also ein klein- und mittelständisches Unternehmen, und haben uns an unternehmen gewandt, da wir kurzfristig eine Zwischenfinanzierung benötigten. Bereits nach dem ersten Gespräch mit unserer Hausbank hatte sich nämlich herausgestellt, dass das Vorgehen und die Entscheidungswege nicht mit unseren Anforderungen und Bedürfnissen zu vereinbaren waren. Ganz anders bei unternehmen: Die Mitarbeiter von unternehmen, sowohl im Vertrieb als auch in der Beratung, sind nicht nur engagiert sondern auch äußerst kundenorientiert. Unser Berater hat seine Aktivitäten ganz auf unseren Bedarf ausgerichtet und zielgerichtet in kürzester Zeit passende Finanzierungspartner gefunden. Der gesamte Prozess war digitalisiert und die Abwicklung sehr problemlos. Vor allem hat uns die Geschwindigkeit mehr als positiv überrascht. Während des gesamten Verfahrens wurden wir von unserem Berater begleitet, jede terminliche Zusage wurde eingehalten. unternehmen hat es u.E. tatsächlich geschafft, die oft analogen und zeitaufwendigen Prozesse bei der Unternehmensfinanzierung von klassischen Banken zu digitalisieren. Da unternehmen dabei extrem serviceorientiert agiert, ist für uns auch das Preis-/Leistungsverhältnis absolut in Ordnung. Wir werden unternehmen auch zukünftig bei Finanzierungsfragen berücksichtigen.";"Gewissenhaft";"We are a typical SME, i.e. a small and medium-sized enterprise, and have turned to companies because we needed interim financing at short notice. Already after the first conversation with our house bank it turned out that the procedure and the decision paths could not be reconciled with our requirements and needs. A different kind of company: The employees of companies, both in sales and in consulting, are not only committed but also extremely customer-oriented. Our consultant has aligned his activities entirely to our needs and found suitable financing partners in the shortest possible time. The entire process was digitalized and the handling was very problem-free. Above all, the speed surprised us more than positively. We were accompanied by our consultant throughout the entire process, and every deadline was met. in our opinion, the company actually managed to digitize the often analogous and time-consuming processes involved in the corporate financing of traditional banks. Since companies are extremely service-oriented, the price/performance ratio is also absolutely in order for us. We will continue to take companies into account in financing issues in the future."
"50";"Der Kontakt gefiel mir sehr gut. Die Bearbeitung war Professionell, die Abwicklung war für mich absolut problemlos. Ich habe mich kompetent beraten gefühlt und bei einem zukünftigen bedarf an einer Finanzierung werde ich mich gerne wieder an dieses Portal wenden.";"Stetig";"I liked the contact very much. The processing was professional, the handling was absolutely problem-free for me.    I felt that I received competent advice and if there is a need for financing in the future, I will gladly turn to this portal again."
"51";"Wir können nur bestätigen, dass die Zusammenarbeit mit der Plattform unternehmen kompetent und zielführend verlaufen ist. Der Berater der unternehmen, Herr vorname nachname hat uns fachgerecht begleitet. Wir haben die gewünschte Finanzierung erhalten und sind mit der GRENKE BANK ist Geschäftsverbindung getreten. Dabei hat der Prozess zwischen Antragsstellung auf der unternehmen Plattform bis zum Angebot gerade mal 9 Tage gedauert. Schneller geht es sicherlich nicht. Die Plattform unternehmen ist eine hervorragende Alternative zur schnellen Mittelstandsfinanzierung. Brunhilde Lademann Geschäftsführung der CUTETECH GmbH";"Gewissenhaft";"We can only confirm that the cooperation with the platform was competent and target-oriented. The consultant of the company, Mr. first name last name accompanied us professionally. We have received the desired financing and have entered into a business relationship with GRENKE BANK. The process between the application on the company platform and the offer took just 9 days. It can't get any faster than that. The platform unternehmen is an excellent alternative to rapid SME financing. Brunhilde Lademann Managing Director of CUTETECH GmbH"
"52";"Guter Support, unkomplizierte Abwicklung. Etwas höherer Zinssatz als bei klassischer Hausbank, dafür schnell und ohne Unmengen von Unterlagen einzureichen. Empfehlenswert.";"Dominant";"Good support, uncomplicated handling. Somewhat higher interest rate than with a traditional house bank, but it can be submitted quickly and without a lot of documentation. Recommended."
"53";"Hervorrangende, freundliche und sehr kompetente Beratung. Zudem eine sehr gut Betreuung im gesamten Verfahren und stets ein Ansprechpartner an meiner Seite. Kann ich nur weiterempfehlen.";"Initiativ";"Excellent, friendly and very competent advice. In addition, very good support throughout the entire process and always a contact person at my side. I can only recommend."
"54";"Also jetzt mal ehrlich, wir kennen alle die old-school Bankenwelt wo alles relativ langsam abläuft. Aber so etwas habe ich noch nie erlebt. In nicht mal 2 Wochen war der Kredit genehmigt - kaum zu glauben. Danke nochmal an den TOP Berater!";"Initiativ";"Honestly, we all know the old-school banking world where everything is relatively slow. But I've never seen anything like it. In less than two weeks the loan was approved - hard to believe. Thanks again to the TOP consultant!"
"55";"Sehr kompetente, schnelle und zuverlässige Beratung bzw. Unterstützung bei allen Fragen. Gerne wieder.";"Stetig";"Very competent, fast and reliable advice and support for all questions. I'd love to."
"56";"super Service, schnelle Bearbeitung";"Initiativ";"super service, fast processing"
"57";"Schnell, unkompilziert, ehrlich.";"Initiativ";"Quick, uncomplicated, honest."
"58";"unternehmen war mir bei der Suche nach einem alternativen Finanzierer sehr hilfreich. Sehr gefallen hat mir, dass von vorn herein klar ist, dass die Finanzierung nicht eben ein Mausklick entfernt ist. Die Ausschreibung war dennoch recht schnell und konnte, auf meinen Wunsch hin, auch, früher als der regulären Zeitraum, beendet werden. Ebenfalls gut, dass vom Mitarbeiter direkt angerufen wurde, weil für einen der Ausschreibungsteilnehmern noch Informationen erforderlich waren. Erstaunlich in meinem Fall war, das ich genau von dem Finanzierer das günstigste Angebot erhalten habe, mit dem ich auch über meine Hausbank finanziert hätte, nur zu besseren Konditionen.";"Gewissenhaft";"The search for an alternative financier was very helpful for me. I really liked the fact that it is clear from the outset that financing is not just a mouse click away. The tender was nevertheless quite fast and could, at my request, also be terminated earlier than the regular period. It was also good that the employee called directly because information was still required for one of the tender participants. It was astonishing in my case that I received the most favourable offer from the financier, with which I would have financed also over my house bank, only to better conditions."
"59";"alles super gelaufen.";"Initiativ";"everything went great."
"60";"kompetent, schnell, sehr gute und seriöse Angebote";"Dominant";"competent, fast, very good and serious offers"
"61";"Top Beratung, zügige Bearbeitung sowie Kreditauszahlung, unkompliziert!!";"Dominant";"Top advice, speedy processing and loan disbursement, uncomplicated!"
"62";"Professionelle Beratung und kundenorientierte Suche nach potenziellen Investoren oder Banken. Kontinuierliche Begleitung bis zum Abschluss.";"Gewissenhaft";"Professional advice and customer-oriented search for potential investors or banks. Continuous support until completion."
"63";"alles bestens";"Dominant";"everything is fine"
"64";"unternehmen, ist Kompetent, schnell und verbindlich.";"Dominant";"is competent, fast and binding."
"65";"Sehr persönliche, schnelle und auf unser Geschäft abgestimmte Beratung.";"Initiativ";"Very personal, fast and business oriented advice."
"66";"Einfache, sichere und schnelle Abwicklung! Alles TOP!";"Initiativ";"Simple, safe and fast processing! Everything TOP!"
"67";"Vielen Dank für die schnelle und unkomplizeirte Bearbeitung der Finanzierungsanfrage. Mein Kunde war begeistert. vorname Stolterfoht Vermögensberater";"Initiativ";"Many thanks for the quick and uncomplicated processing of the financing request. My client was thrilled. first name Stolterfoht investment advisor"
