"";"text";"type";"Englisch"
"150";"Meine bisherige Erfahrung beruht auf der Betreuung durch Frau Laux. Ich kann durchweg nur absolut positiv berichten. Die Zusammenarbeit war eloquent, professionell, zuverlässig, super sympathisch, einfach perfekt. Jeder Zeit und immer wieder…";"Initiativ";"My previous experience is based on the support of Mrs. Laux. I can only report absolutely positively throughout. The cooperation was eloquent, professional, reliable, super sympathetic, simply perfect. Every time and over and over again..."
"151";"unternehmen hat uns sehr bei der Finanzierung unseres Bürogebäudes geholfen. Gerne wieder!";"Stetig";"The company helped us a lot with the financing of our office building. Again with pleasure! "
"152";"Frau nachname ist eine sehr engagierte Dame , die hervorragende Arbeit leistet , sie wäre für jedes Unternehmen ein großer Gewinn.";"Initiativ";"Woman surname is a very dedicated lady who does excellent work, she would be a great asset to any business."
"153";"Top Beratung, kurze Wege, schnelle Entscheidungen!";"Dominant";"Top advice, short distances, quick decisions!"
"154";"Super Service, jederzeit gerne wieder";"Initiativ";"Super service, anytime gladly again"
"155";"In der heutigen Zeit - insbesondere wo sich die Geschäftsmodelle der Banken und Finanzinstitute zum Teil dramatisch verändern - ist es für ein mittelständisches Unternehmen aus der Solarbranche wie unser, wichtig zu wissen, einen Partner wie unternehmen an der Seite zu haben. Ein Partner, der in (fast) allen Finanzierungsfragen Lösungen anbieten kann.";"Initiativ";"Nowadays - especially when the business models of banks and financial institutions are changing dramatically - it is important for a medium-sized company in the solar industry such as ours to know that it has a partner like a company on its side. A partner who can offer solutions for (almost) all financing issues."
"156";"Sehr bemüht, professionell und unterstützend.";"Dominant";"Very hard working, professional and supportive."
"157";"Toller Service und kompetente Ansprechpartner!";"Dominant";"Great service and competent contact persons!"
"158";"5 Sterne, dass sagt alles. Kann dieses Unternehmen insbesondere Frau nachname nur weiterempfehlen. Kompetent - freundlich - geduldig und Verständnisvoll Immer wieder gerne";"Initiativ";"5 stars, that says it all. Can only recommend this company especially woman surname. Competent - friendly - patient and understanding Always happy to do it again"
"159";"Schnell, unkompliziert, zuverlässig und kompetent, so wie man es in der heutigen Zeit braucht. Jederzeit wieder gerne.";"Initiativ";"Fast, uncomplicated, reliable and competent, just as you need it today. Anytime again gladly."
"160";"Ich kann unternehmen empfehlen";"Dominant";"I can recommend companies"
"161";"Übersichtliches Portal. Schnelle Kontaktaufnahme und Unterstützung. Die Kontaktpersonen sind immer bemüht und freundlich.";"Stetig";"Clear portal. Quick contact and support. The contact persons are always endeavoured and friendly."
"162";"Die Bearbeitung war zügig und wir wurden immer zeitnah über den aktuellen Stand informiert. Wenn man nicht selbst lange Recherchen anstellen will und eine große Breite an Anbietern nutzen möchte, ist unternehmen sehr zu empfehlen. Wir hatten Erfolg!";"Stetig";"The processing was speedy and we were always promptly informed about the current status. If you don't want to carry out long researches yourself and want to use a wide range of providers, then unternehmen is highly recommended. We succeeded!"
"163";"Ich kann unternehmen nur empfehlen. Mein Ansprechpartner dort war sehr engagiert, hat mich gut beraten. Nach Einreichung der Unterlagen hatte ich sehr schnell ein Angebot und kurz darauf wurde mir das Darlehen zur Verfügung gestellt.";"Gewissenhaft";"I can only recommend undertaking. My contact person there was very committed and gave me good advice. After submitting the documents, I very quickly received an offer and shortly afterwards the loan was made available to me."
"164";"Eine wunderbare Zusammenarbeit mit hervorragenden Ergebnissen. Durch die maximale Machbarkeitswahscheinlichkeit und dem Ausschreibungsnachnameip wird für den Kunden das bestmöglich Angebot im schwierigen Markt der Gewerbefinanzierungen erzeugt. Gepaart mit persönlicher und hochspezialisierter Beratung macht die Zusammenarbeit sehr viel Spaß! Wir freuen uns über weitere gemeinsame Projekte!";"Initiativ";"A wonderful cooperation with excellent results. The maximum probability of feasibility and the post tender tender tender procedure ensure that the customer receives the best possible offer in the difficult commercial financing market. Coupled with personal and highly specialized advice, the cooperation is a lot of fun! We are looking forward to further joint projects!"
"165";"Ausschreibungsverfahren führt zu effizieter Bündelung der Aktivitäten. Professionelle bearbeitung von Rückfragen.";"Dominant";"Tendering procedure leads to efficient bundling of activities. Professional processing of queries."
"166";"Die Bearbeitung war hervorragend. Sehr schnell und unbürokratisch. Ich kann es nur weiter empfehlen.";"Initiativ";"The processing was excellent. Very fast and unbureaucratic. I can only recommend it."
"167";"Schnell, einfach, günstiger und besser ??";"Initiativ";"Fast, easy, cheaper and better ??"
"168";"Sehr gute und kompetente Beratung, kann man nur empfehlen!";"Initiativ";"Very good and competent advice, one can only recommend!"
"169";"sehr einfache Handhabung bei Eingabe der Anfrage, sehr schnelle Reaktion, äußerst engagierte Mitarbeiter!";"Initiativ";"very easy handling when entering the request, very fast reaction, extremely dedicated staff!"
"170";"Die Unterstützung war sehr hilfreich!";"Stetig";"The support was very helpful!"
"171";"alles ging schnell und problemlos.";"Dominant";"everything went quickly and smoothly."
"172";"Kompetente, fachlich versierte, lösungsorientierte Ansprechpartner, die auch Alternativüberlegungen einbringen; empfehlenswert";"Gewissenhaft";"Competent, technically experienced, solution-oriented contact persons, who also bring in alternative considerations; recommendable"
"173";"unternehmen hat nach kurzer Beratung das passende Angebot vermitteln können. Dabei wurde ohne viel Umschweife auf die wichtigsten Punkte eingegangen. Von der Kontaktaufnahme zu unternehmen bis zur Auszahlung des Kredites sind nicht einmal 2 Wochen vergangen.";"Gewissenhaft";"After a short consultation, the company was able to provide the appropriate offer. The most important points were dealt with without much digression. Less than 2 weeks have elapsed between the time of contacting the bank and the payment of the loan."
"174";"Sehr netter, kompetenter Kontakt. Empfehlenswert. Vielen Dank!";"Initiativ";"Very nice, competent contact. Recommended. Thank you very much."
"175";"Nach anfänglichen Startschwierigkeiten Top-Service und Flexiblität";"Dominant";"After initial start-up difficulties top service and flexibility"
"176";"Eine wundervolles Konzept für Unternehmensfinanzierungen.";"Initiativ";"A wonderful concept for corporate finance."
"177";"Engagierte und kompetente Mitarbeiter, die auch mögliche Alternativen aufzeigen und sich eigeninitiativ um die Belange des Kunden kümmern. Uneingeschränkt empfehlenswert.";"Initiativ";"Dedicated and competent employees who also point out possible alternatives and take the initiative to look after the customer's interests. Unrestrictedly recommendable."
"178";"Dynamisch und zuverlässig";"Dominant";"Dynamic and reliable"
"179";"Gute Portallösung mit persönlichen Beratern, die freundlich und zuverlässig die passenden Konzeptionen erstellen.";"Stetig";"Good portal solution with personal consultants who create the appropriate concepts in a friendly and reliable manner."
"180";"Für Privatkunden gibt es viele Vergleichsportale...aufmerksam geworden durch eine Werbung, finden wir es toll, dass Unternehmen - auch unabhängig von einer Hausbank unkompliziert, aber mit persönlicher Beratung zu dem jeweiligen Projekt eine Finanzierung suchen können";"Initiativ";"For private customers there are many comparison portals...become attentive by an advertisement, we find it great that enterprises - also independently of a house bank uncomplicatedly, but with personal consultation to the respective project a financing can look for can"
"181";"Die Vermittlung von Finanzierungsanfragen erfolgt höchst kompetent. Aufgrund der offenen Kommunikation konnten die Anfragen in kürzester Zeit zum Abschluss gebracht werden.";"Gewissenhaft";"The mediation of financing enquiries is highly competent. Due to the open communication the inquiries could be brought to a conclusion in shortest time."
"182";"kompetent schnell und super freundlich";"Initiativ";"competent fast and super friendly"
"183";"Top Service, schnelle Entscheidungsfindung. Mit unternehmen taucht man in eine völlig neue Welt der Finanzierung ein. Wer jetzt noch sagt Deutschland sei eine  Servicewüste der soll sich bitte mit unternehmen in Verbindung setzen.";"Initiativ";"Top service, fast decision making. With unternehmen one dives into a completely new world of financing. Who now still says that Germany is a service desert should please contact companies."
"184";"Sehr gute Beratung, schnelle Reaktionszeit";"Initiativ";"Very good advice, fast response time"
"185";"Ausreichend gute Angebote in guter Zeit";"Gewissenhaft";"Sufficiently good offers in good time"
"186";"Kompetente Beratung einfacher Prozess, Spitze.";"Initiativ";"Competent advice simple process, top."
"187";"Es ist sehr wichtig gut beratet zu werden.. für mich wars auch sehr wichtig dass zügig auf anschreiben antwort kommt .. ich finde es super dass sofort auf e mails und anrufe geantwortet worden ist . Ich kann es nur weiterempfelen .. ????";"Initiativ";"It's very important to be well advised... for me it was also very important that quickly on letter answer comes ... I think it super that immediately on e mails and calls has been answered. I can only recommend it. ????"
"188";"Habe mich sehr gut beraten und betreut gefühlt jederzeit gerne wieder.";"Stetig";"I have very well advised and felt cared for at any time gladly again."
"189";"Bei der Beantragung von Betriebsmitteln für einen Klienten hat die einfache Handhabung der Homepage, zusammen mit der persönlichen Prüfung und Optimierung der Anfrage durch Herrn nachname als Kundenberater, zum erfolgreichen Abschluss geführt. Vielen Dank!";"Gewissenhaft";"When applying for resources for a client, the simple handling of the homepage, together with the personal check and optimization of the request by Mr. surname as customer consultant, led to a successful conclusion. Thank you very much."
"190";"Schneller & freundlicher Service!";"Initiativ";"Fast & friendly service!"
"191";"Herr nachname der Berater war Einwandfrei Sachlich hat Erfahrung und Kompetenz die seines Gleichen Sucht. Danke Herr Gurschke";"Initiativ";"Mr surname the consultant was Impeccable Objectively has experience and competence the same as his addiction. Thank you Mr Gurschke"
"192";"Schnelle, kompetente Abwicklung";"Dominant";"Fast, competent processing"
"193";"Nach Spezifizierung unserer Anfrage erhielten wir kurzfristig mehrere Finanzierungsangebote. Bei Rückfragen konnten wir jederzeit unseren Ansprechpartner bei unternehmen sprechen. Sehr angenehmer Kontakt, können wir nur empfehlen.";"Stetig";"After specifying our request, we received several financing offers at short notice. If we had any questions, we were able to talk to our contact person at the company at any time. Very pleasant contact, we can only recommend."
"194";"Kompetente Beratung und Unterstützung";"Dominant";"Competent advice and support"
"195";"Sehr zügige und zielführende Beratung am Telefon sowie Vermittlung von Finanzierern - auch bei Speizailmaschinen. Gerne wieder!";"Dominant";"Very quick and target-oriented advice on the phone and the procurement of financiers - also for speizail machines. Again with pleasure!"
"196";"Prompte Bearbeitung der Kreditanfrage Kontinuierlicher Ansprechpartne Gute Erreichbarkeit Direkte offene Kommunikation";"Gewissenhaft";"Prompt processing of credit enquiries Continuous contact Good availability Direct open communication"
"197";"Das Angebot kam schnell mit guten Konditionen mit Nachverhandlung!";"Dominant";"The offer came quickly with good terms with renegotiation!"
"198";"Ich war mit der Tätigkeit von unternehmen sehr zufrieden und kann die Gesellschaft guten Gewissens weiter empfehlen. Mein Sachbearbeiter, Herr nachname, stand mir äußerst kompetent für alle Fragen jederzeit zur Verfügung. Äußerst hilfreich war sein Wissen, wie Banken heutzutage ticken . In allen Besprechungen mit den Banken war seine Verhandlungsführung Danke.";"Stetig";"I was very satisfied with the activities of the companies and can recommend the company to others with a clear conscience. My clerk, Mr. surname, was always available to answer all my questions in an extremely competent manner. His knowledge of how banks ""tick"" these days was extremely helpful. In all meetings with the banks, his conduct of negotiations was very helpful and purposeful. Thank you. I'll take care of it."
"199";"Mein Ansprechpartner bei unternehmen, Herr nachname, ist nicht nur kompetent und effektiv, sondern auch schnell. Und allein das zählt in der Wirtschaft. Weiter so! Ich kann unternehmen nur wärmstens empfehlen.";"Initiativ";"My contact person at company, Mr. surname, is not only competent and effective, but also fast. And that alone counts in business. Keep it up! I can only warmly recommend undertaking."
"200";"Kompetente und gute Beratung sowie ein offener und schneller Service! Gerne wieder.";"Stetig";"Competent and good advice as well as an open and fast service! I'd love to."
"201";"Super Beratung und Unterstützung";"Initiativ";"Super advice and support"
"202";"+ geringer Aufwand für die Erstellung einer Kreditanfrage erfolgreiche Vermittlung von zwei Firmenkrediten (Gesamt: 520 TSD Euro) Vermittlung einer Bank, die wir sonst nie angesprochen hätten (apoBank) super Konditionen kompetente, freundliche und kreative Mitarbeiterin schnelle Antworten per E-Mail, telefonisch erreichbar";"Gewissenhaft";"+ low expenditure for the production of a credit inquiry + successful switching of two firm credits (altogether: 520 TSD euro) + switching of a bank, which we would not have addressed otherwise (apoBank) + super conditions + competent, friendly and creative woman employee + fast answers by E-Mail, by telephone attainable"
"203";"Sehr kompetente Beratung, immer auf der Suche nach einer passender Lösung. Ich war positiv überrascht über so viel Engagement.";"Initiativ";"Very competent advice, always looking for a suitable solution. I was positively surprised by so much commitment."
"204";"Die Zusammenarbeit mit den Mitarbeitern der Firma unternehmen waren sehr gut.";"Stetig";"The cooperation with the employees of the company was very good."
"205";"Kompetente Ansprechpartner und schnelle Ergebnisse und Entscheidungen!";"Dominant";"Competent contact persons and fast results and decisions!"
"206";"Kompetente, persönliche Kundenbetreuung!";"Stetig";"Competent, personal customer service!"
"207";"Hervorragende Beratung und vor allem auch sehr gute persönliche Betreuung !";"Initiativ";"Excellent advice and above all very good personal support !"
"208";"Sehr netter Kontakt.";"Stetig";"Very nice contact. "
"209";"Sehr schnell und gutes Angebot";"Dominant";"Very fast and good offer"
"210";"Alles reibungslos.";"Dominant";"Everything's smooth."
"211";"schnelle Bearbeitung leichte Kommunikationsprobeme";"Dominant";"fast processing easy communication tests"
"212";"professionelle und termingerechte Betreuung, sehr gutes Ergebnis";"Dominant";"professional and timely support, very good result"
"213";"Sehr freundliche und persönliche Beratung.";"Stetig";"Very friendly and personal advice."
"214";"schnelle und unkomplizierte Bearbeitung.";"Dominant";"fast and uncomplicated processing."
"215";"Top Service / Der Ansprechpartner hat sich ohne aufzugeben sehr gut und intensiv gekümmert.";"Initiativ";"Top Service / The contact person has taken very good and intensive care of himself without giving up. "
"216";"Durch die professionelle Aufbereitung unserer Anfrage wurde das angefragte Darlehen innerhalb weniger Tage durch einen alternativen Finanzierer genehmigt und ausgezahlt.";"Gewissenhaft";"Due to the professional preparation of our request, the requested loan was approved and disbursed within a few days by an alternative financier. "
"217";"Seriös und kompetent. Und es hat wunderbar geklappt. Umschuldung, weg von Dispo mit 8.9 % hin zu Annuitätenkredit sehr guten Konditionen.";"Gewissenhaft";"Serious and competent. And it worked wonderfully. Debt rescheduling, away from overdrafts with 8.9 % to annuity loans with very good conditions."
"218";"Sehr kompetente Beratung und individuelle Lösungen auch in schwierigen Themenbereichen möglich. Fazit: Sehr empfehlenswert!";"Dominant";"Very competent advice and individual solutions also possible in difficult subject areas. Conclusion: Very recommendable!"
"219";"Unkompliziert und schnell. Vielen Dank für die gute Zusammenarbeit";"Initiativ";"Uncomplicated and fast. Thank you very much for the good cooperation. "
"220";"Sehr gute Plattform !";"Dominant";"Very good platform !"
"221";"Freundlicher und kompetenter Service";"Initiativ";"Friendly and competent service"
"222";"Es hat alles sehr super und unkompliziert Funktioniert, kann man nur weiter empfehlen…";"Initiativ";"Everything worked very well and uncomplicatedly, you can only recommend it to others..."
"223";"Freundliche, kompetente Unterstützung bei der Ausschreibung. Gesprächstermine werden genau eingehalten. Da sich für uns eine andere Lösung ergeben hatte, kam der Kreditvertrag nicht zustande. Der Ablauf bis dahin war reibungslos.";"Gewissenhaft";"Friendly, competent support during the tender process. Appointments are strictly adhered to. Since a different solution had arisen for us, the credit agreement was not concluded. The process until then was smooth."
"224";"Unkomplizierte und vor allem persönliche Abwicklung der Anfragen. Ich war zu Anfang skeptisch unternehmensrelevante Daten hochzuladen. Durch ein persönliches Gespräch mit unserem veranwortlichen Betreuer, wurden diese Bedenken aber sofort entkräftet. Die Anfragen wurden in ein bis zwei Wochen positiv entschieden. Das nächste Mal werden wir genauso wieder vorgehen.";"Stetig";"Uncomplicated and above all personal handling of enquiries. At the beginning I was sceptical about uploading company-relevant data. Through a personal conversation with our responsible supervisor, however, these concerns were immediately refuted. The inquiries were positively decided in one to two weeks. Next time we'll do the same again."
"225";"Persönliche Beratung top";"Stetig";"Personal advice top"
"226";"Sehr überzeugender Service! Kompetent und schnell! Werde es auf jeden Fall wieder nutzen.";"Initiativ";"Very convincing service! Competent and fast! I'll definitely use it again."
"227";"Hat super geklappt.";"Initiativ";"Worked great."
"228";"Ich hatte einen Kontokorrentkredit ausgeschrieben und innerhalb einer Woche hatte ich drei Angebote, die günstiger waren als bei meiner Hausbank. Echt Klasse. Mache meine nächsten Finanzierungen auch wieder mit unternehmen.";"Stetig";"I had a current account credit written out and within a week I had three offers which were cheaper than with my house bank. Really great. Do my next financing also again with undertake."
"229";"*Gute Ansprache und Erreichbarkeit eines Beraters Lösungs- und erfolgsorientierte Herangehensweise Die Finanzierung konnte erfolgreich abgeschlossen werden";"Gewissenhaft";"*Good approach and availability of a consultant *Solution and success-oriented approach *Financing successfully completed"
"230";"Alles bestens!";"Dominant";"Everything's fine!"
"231";"Alles bestens, bei Bedarf gerne wieder.";"Stetig";"Everything's fine, and we'll be happy to do it again if you need it."
"232";"alles ok";"Dominant";"everything ok"
"233";"alles super gelaufen mit der kompletten Abwicklung";"Initiativ";"everything ran super with the complete handling"
"234";"Angefragt hatte ich das Sale and Lease Back meines Maschinenparks. Da die Bewertung der Maschinen sich seitens Gutachter etwas gezogen hat, konnte mein Berater mir binnen weniger Stunden eine Kreditzusage über ein Engagement von ***€ Einholen. So stelle ich mir das vor!";"Gewissenhaft";"I had asked for the Sale and Lease Back of my machinery. Since the evaluation of the machines has itself on the part of consultants something pulled, my advisor could obtain a credit promise to me within fewer hours over an engagement of ***€. That's what I'm thinking!"
"235";"Ansprechpartner hat sich sofort um unser Anliegen gekümmert und uns bis zur Lieferung mit Rat und Tat begleitet. Er war verbindlich und hat alle Zusagen gehalten. Top Leistung !!! Es war nur ein Waschanlagen Kauf, aber ich würde auch größere Projekte mit dem Anbieter machen.";"Initiativ";"The contact person immediately took care of our request and accompanied us with words and deeds until delivery. He was binding and kept all promises. Top performance !!! It was just a car wash purchase, but I would also make larger projects with the supplier."
"236";"Auch wenn wir bis dato noch keine Fremdmittel aufnehmen mussten, über unternehmen ging das sehr schnell und relativ einfach ohne aufwendige bürokratische Hürden.";"Gewissenhaft";"Even though we hadn't had to borrow any funds so far, we were able to do this very quickly and relatively easily without any complicated bureaucratic hurdles."
"237";"Auf der Suche nach einer Sattelzugmaschine bin ich auf unternehmen gestoßen. Innerhalb kürzester Zeit hatte ich vier Angebote vorliegen und konnte mir das optimale aussuchen. Der Ablauf war schnell und unkompliziert, ich sage Danke!";"Gewissenhaft";"In my search for a tractor unit, I came across some companies. Within a very short time I had four offers and was able to choose the best one. The process was quick and uncomplicated, I say thank you!"
"238";"Auf Umwegen haben wir von dieser Finanzagentur erfahren. Nach einer Anfrage von unserer Seite bekamen wir sofort einen hilfreichen Rückruf zur Abklärung unserer Situation. Daraufhin haben wir spontan alle Unterlagen erhalten, die wir zur Darstellung unseres Finanzproblems brauchten. Die Firma unternehmen hat sich sogleich mit unseren Unterlagen auf die Suche nach einem Finanzpartner begeben. Wenige Tage später erreichten uns dann entsprechende Angebote. Wir sind zu 100% zufrieden gestellt worden.";"Initiativ";"We have learned about this finance agency through detours. After a request from our side, we immediately got a helpful call back to clarify our situation. As a result, we spontaneously received all the documents we needed to present our financial problem. The company unternehmen immediately started to search for a financial partner with our documents. A few days later we received corresponding offers. We have been 100% satisfied."
"239";"Beim Wareneinkauf konnte mich unternehmen. Mit einer Einkaufsfinazierung perfekt Unterstützen. Ich freue mich auf das nächste Projekt.";"Stetig";"When buying goods could do me. Support perfectly with a purchasing refinement. I'm looking forward to the next project."
"240";"Beratung war sehr zielführend.";"Dominant";"Consulting was very target-oriented."
"241";"Besonders gelungen war der unkomplizierte Datenaustausch mit unternehmen. Nach der Anmeldung erhielten wir zugang zu einer Plattform auf welcher wir unsere Dokumente umgehen hochladen und den Bearbeitungsstand einsehen konnten.";"Gewissenhaft";"The uncomplicated data exchange with companies was particularly successful. After the registration we got access to a platform where we could bypass our documents, upload them and view the processing status."
"242";"Bin sehr zufrieden, ging Alles schnell und kompetent über die Bühne.";"Dominant";"I am very satisfied, everything went quickly and competently over the stage."
"243";"Dank unternehmen konnte ich einen passenden Factoringpartner finden mit dem ich sehr gut zusammenarbeite. Der Vergleich der Konditionen und Gebühren hat mir viel Zeit und Aufwand gespart";"Gewissenhaft";"Thanks to unternehmen I was able to find a suitable factoring partner with whom I work very well. The comparison of conditions and fees saved me a lot of time and effort."
"244";"Dank unternehmen konnte ich mir eine Anschlussfinanzierung innerhalb weniger Tage sichern. Damit konnte ich meine Geschäftsfelder erweitern und den Umsatz steigern. Kann ich so empfehlen.";"Stetig";"Thanks to unternehmen unternehmen I was able to secure follow-up financing within a few days. This enabled me to expand my business areas and increase sales. I recommend it."
"245";"Der Einsatz aller Mitarbeiter von unternehmen war beispielhaft. Zu jedem vereinbarten Termin kamen pünktlich die Ansagen. Durch die Vermittlung von unternehmen konnten wir eine Lösung für unsere Finanzierung finden. Wir werden unternehmen in jedem Falle weiterempfehlen.";"Initiativ";"The commitment of all company employees was exemplary. The announcements came punctually to every agreed date. Through the mediation of companies, we were able to find a solution for our financing. We will recommend companies in any case."
"246";"Der Finanzbedarf wurde kompetent und schnell gelöst. Vielen Dank";"Dominant";"The financial requirements were solved competently and quickly. Thank you very much."
